RINGKASAN,KOMEN
"TERKAIT K5424031500846, K5424031501039 MOHON TINDAK LANJUT DAN PENYELESAIAN , NIK PELANGGAN 3522042512940004 A.N BUDI DARMAWAN TELAH TERDAFTAR DIGUNAKAN ORANG LAIN SEBAGAI PENERIMA SUBSIDI LISTRIK. SESUAI INFO PELANGGAN, YBS TIDAK PERNAH MENGGUNAKAN KTP TERSEBUT, DAN PELANGGAN MENGINGINKAN UNTUK DICABUT PADA ID PELANGGAN SEBELUMNYA. TERKAIT  INFO DARI PELANGGAN TIDAK MELAKUKAN PEMBATALAN.",NEGATIVE
"MOHON TINDAK LANJUT DAN PENYELESAIAN , NIK PELANGGAN 3522042512940004 A.N BUDI DARMAWAN TELAH TERDAFTAR DIGUNAKAN ORANG LAIN SEBAGAI PENERIMA SUBSIDI LISTRIK. SESUAI INFO PELANGGAN, YBS TIDAK PERNAH MENGGUNAKAN KTP TERSEBUT, DAN PELANGGAN MENGINGINKAN UNTUK DICABUT PADA ID PELANGGAN SEBELUMNYA. TERKAIT K5424031500846, INFO DARI PELANGGAN TIDAK MELAKUKAN PEMBATALAN.",NEGATIVE
"TERKAIT NO LAPOR K5224031500168, K5423052500232, K5224031301321, K5424031304063 , K5424031304237, K5424031304409 DAN K5424031306000. PELANGGAN BERMAKSUD MENGAJUKAN PASANG BARU TARIF SUBSIDI DENGAN NO KTP PEMILIK BANGUNAN 3522042512940004  ATAS NAMA BUDI DARMAWAN. PEMOHON MENGAKU SEBAGAI PEMILIK PERSIL. NAMUN PADA DATA AP2T TERTERA NO KTP 3522042512940004  SUDAH TERDAFTAR SUBSIDI LISTRIK DENGAN ID PEL MILIK ORANG LAIN. SESUAI INFO PELANGGAN SUDAH DIKONFIRMASI PETUGAS DAN DIARAHKAN UNTUK DATANG KE KANTOR UNIT PELANGGAN TELAH DATANG KE UNIT TGL 13-03-2024 PUKUL 10.00 NAMUN PELANGGAN MERASA DIBERATKAN. HINGGA SAAT INI BELUM ADA TINDAKLANJUT.",NEGATIVE
"MOHON TINDAK LANJUT DAN PENYELESAIAN , NIK PELANGGAN 3522042512940004 A.N BUDI DARMAWAN TELAH TERDAFTAR DIGUNAKAN ORANG LAIN SEBAGAI PENERIMA SUBSIDI LISTRIK. SESUAI INFO PELANGGAN, YBS TIDAK PERNAH MENGGUNAKAN KTP TERSEBUT, DAN PELANGGAN MENGINGINKAN UNTUK DICABUT PADA ID PELANGGAN SEBELUMNYA.",NEGATIVE
PELANGGAN PENGAJUAN PB DAYA 10600 VA  UNTUK PENGAIRAN SAWAH SEKITAR 2 MINGGU TGL 04/03/2024  MELALUI KANTOR PLN  BELUM MENDAPAT  NO REGISTER . DOKUMEN PENDUKUNG SUDAH DISERAHKAN DAN AKAN DILAKUKAN  SURVEY NAMUN BELUM ADA TINDAK LANJUT,NEGATIVE
"PELANGGAN BERMAKSUD MENGAJUKAN PASANG BARU TARIF SUBSIDI DENGAN NO KTP PEMILIK BANGUNAN 3522042512940004  ATAS NAMA BUDI DARMAWAN. PEMOHON MENGAKU SEBAGAI PEMILIK PERSIL. NAMUN PADA DATA AP2T TERTERA NO KTP 3522042512940004  SUDAH TERDAFTAR SUBSIDI LISTRIK DENGAN ID PEL MILIK ORANG LAIN. SESUAI INFO PELANGGAN SUDAH DIKONFIRMASI PETUGAS DAN DIARAHKAN UNTUK DATANG KE KANTOR UNIT PELANGGAN TELAH DATANG KE UNIT TGL 13-03-2024 PUKUL 10.00 NAMUN PELANGGAN MERASA DIBERATKAN. TERKAIT NO LAPOR K5423052500232 DAN K5224031301321 DAN K5424031304063 , K5424031304237 DAN K5424031304409 DAN K5424031306000",NEGATIVE
"TERKAIT: K5424031306000 PELANGGAN BERMAKSUD MENGAJUKAN PASANG BARU TARIF SUBSIDI DENGAN NO KTP PEMILIK BANGUNAN 3522042512940004  ATAS NAMA BUDI DARMAWAN. PEMOHON MENGAKU SEBAGAI PEMILIK PERSIL. NAMUN PADA DATA AP2T TERTERA NO KTP 3522042512940004  SUDAH TERDAFTAR SUBSIDI LISTRIK DENGAN ID PEL MILIK ORANG LAIN. SESUAI INFO PELANGGAN SUDAH DIKONFIRMASI PETUGAS DAN DIARAHKAN UNTUK DATANG KE KANTOR UNIT PELANGGAN TELAH DATANG KE UNIT TGL 13-03-2024 PUKUL 10.00 NAMUN PELANGGAN MERASA DIBERATKAN. TERKAIT NO LAPOR K5423052500232 DAN K5224031301321 DAN K5424031304063 , K5424031304237 DAN K5424031304409 STS BATAL",NEGATIVE
"K5424031500166LAPORAN BERULANG TERKAIT K5424031304409, K5223052300126, K5223052200477 DAN K5423052400207 PERMASALAHAN SEBELUMNYA PELANGGAN BERMAKSUD MENGAJUKAN PASANG BARU TARIF SUBSIDI DENGAN NO KTP PEMILIK BANGUNAN 3522042512940004  ATAS NAMA BUDI DARMAWAN. PEMOHON MENGAKU SEBAGAI PEMILIK PERSIL. NAMUN PADA DATA AP2T TERTERA NO KTP 3522042512940004  SUDAH TERDAFTAR SUBSIDI LISTRIK DENGAN ID PEL MILIK ORANG LAIN. SESUAI INFO PELANGGAN SUDAH DIKONFIRMASI PETUGAS DAN DIARAHKAN UNTUK DATANG KE KANTOR UNIT PELANGGAN TELAH DATANG KE UNIT TGL 13-03-2024 PUKUL 10.00 NAMUN PELANGGAN MERASA DIBERATKAN. TERKAIT NO LAPOR K5423052500232 DAN K5224031301321 DAN K5424031304063 DAN K5424031304237 STS BATAL. HINGGA SAAT INI BELUM ADA TINDAKLANJUT.",NEGATIVE
"LAPORAN BERULANG TERKAIT K5424031304409, K5223052300126, K5223052200477 DAN K5423052400207 PERMASALAHAN SEBELUMNYA PELANGGAN BERMAKSUD MENGAJUKAN PASANG BARU TARIF SUBSIDI DENGAN NO KTP PEMILIK BANGUNAN 3522042512940004  ATAS NAMA BUDI DARMAWAN. PEMOHON MENGAKU SEBAGAI PEMILIK PERSIL. NAMUN PADA DATA AP2T TERTERA NO KTP 3522042512940004  SUDAH TERDAFTAR SUBSIDI LISTRIK DENGAN ID PEL MILIK ORANG LAIN. SESUAI INFO PELANGGAN SUDAH DIKONFIRMASI PETUGAS DAN DIARAHKAN UNTUK DATANG KE KANTOR UNIT PELANGGAN TELAH DATANG KE UNIT TGL 13-03-2024 PUKUL 10.00 NAMUN PELANGGAN MERASA DIBERATKAN. TERKAIT NO LAPOR K5423052500232 DAN K5224031301321 DAN K5424031304063 DAN K5424031304237 STS BATAL. HINGGA SAAT INI BELUM ADA TINDAKLANJUT.",NEGATIVE
"daya tdk stabil,kadang naik turun",NEGATIVE
MCB sering njeglek,NEGATIVE
Aktivasi meteran,NEGATIVE
listrik mati dari tadi malam,NEGATIVE
listrik mati,NEGATIVE
mucul tulisan rusak pada kwh meter,NEGATIVE
"tolong dong listrik wilayah gondang ini dipindah jalur dari bojonegoro saja, soalnya ikut caruban/madiun hampir tiap hari mati di musim penghujan seperti sekarang. tentu itu merugikan kami sebagai pedagang kecil ( ice cream meleleh contohnya ). Penyebab kematiannyapun banyak seperti pohon tumbang, konslet, travo rusak. yang paling bikin saya heran kadang tidak hujan,tidak ada anginpun juga mati. terimakasih sebelumnya.",POSITIF
selalu ada pemadaman setiap hari,NEGATIVE
"hampir setiap hari listrik padam, kebutuhan listrik setiap hari. kalau bisa listriknya ambil dari arah bojonegoro biar tidak terlalu sering pemadaman",POSITIF
"PELANGGAN BERMAKSUD MENGAJUKAN PASANG BARU TARIF SUBSIDI DENGAN NO KTP PEMILIK BANGUNAN 3522042512940004  ATAS NAMA BUDI DARMAWAN. PEMOHON MENGAKU SEBAGAI PEMILIK PERSIL. NAMUN PADA DATA AP2T TERTERA NO KTP 3522042512940004  SUDAH TERDAFTAR SUBSIDI LISTRIK DENGAN ID PEL MILIK ORANG LAIN. SESUAI INFO PELANGGAN SUDAH DIKONFIRMASI PETUGAS DAN DIARAHKAN UNTUK DATANG KE KANTOR UNIT PELANGGAN TELAH DATANG KE UNIT TGL 13-03-2024 PUKUL 10.00 NAMUN PELANGGAN MERASA DIBERATKAN. TERKAIT NO LAPOR K5423052500232 DAN K5224031301321 DAN K5424031304063 , K5424031304237 DAN K5424031304409 STS BATAL",NEGATIVE
"PELANGGAN NO METER 86241138543 TIDAK BISA MEMASUKKAN STROOM, LPB TERTERA KET GAGAL. SISA 101.00 KWH . BANGUNAN MENYALA. 0874 3478 2211 8717 7010",NEGATIVE
PELANGGAN BERMAKSUD MENGAJUKAN PASANG BARU TARIF SUBSIDI DENGAN NO KTP PEMILIK BANGUNAN 3522042512940004  ATAS NAMA BUDI DARMAWAN. PEMOHON MENGAKU SEBAGAI PEMILIK PERSIL. NAMUN PADA DATA AP2T TERTERA NO KTP 3522042512940004  SUDAH TERDAFTAR SUBSIDI LISTRIK DENGAN ID PEL MILIK ORANG LAIN. SESUAI INFO PELANGGAN SUDAH DIKONFIRMASI PETUGAS DAN DIARAHKAN UNTUK DATANG KE KANTOR UNIT PELANGGAN TELAH DATANG KE UNIT TGL 13-03-2024 PUKUL 10.00 NAMUN PELANGGAN MERASA DIBERATKAN. TERKAIT NO LAPOR K5423052500232 DAN K5224031301321 DAN K5424031304063 DAN K5424031304237 STS BATAL,NEGATIVE
PELANGGAN BERMAKSUD MENGAJUKAN PASANG BARU TARIF SUBSIDI DENGAN NO KTP PEMILIK BANGUNAN 3522042512940004  ATAS NAMA BUDI DARMAWAN. PEMOHON MENGAKU SEBAGAI PEMILIK PERSIL. NAMUN PADA DATA AP2T TERTERA NO KTP 3522042512940004  SUDAH TERDAFTAR SUBSIDI LISTRIK DENGAN ID PEL MILIK ORANG LAIN. SESUAI INFO PELANGGAN SUDAH DIKONFIRMASI PETUGAS DAN DIARAHKAN UNTUK DATANG KE KANTOR UNIT PELANGGAN TELAH DATANG KE UNIT TGL 13-03-2024 PUKUL 10.00 NAMUN PELANGGAN MERASA DIBERATKAN. TERKAIT NO LAPOR K5423052500232 DAN K5224031301321 DAN K5424031304063 STS BATAL,NEGATIVE
PELANGGAN BERMAKSUD MENGAJUKAN PASANG BARU TARIF SUBSIDI DENGAN NO KTP PEMILIK BANGUNAN 3522042512940004  ATAS NAMA BUDI DARMAWAN. PEMOHON MENGAKU SEBAGAI PEMILIK PERSIL. NAMUN PADA DATA AP2T TERTERA NO KTP 3522042512940004  SUDAH TERDAFTAR SUBSIDI LISTRIK DENGAN ID PEL MILIK ORANG LAIN. SESUAI INFO PELANGGAN SUDAH DIKONFIRMASI PETUGAS DAN DIARAHKAN UNTUK DATANG KE KANTOR UNIT PELANGGAN TELAH DATANG KE UNIT TGL 13-03-2024 PUKUL 10.00 NAMUN PELANGGAN MERASA DIBERATKAN. TERKAIT NO LAPOR K5423052500232 DAN K5224031301321 STS BATAL,NEGATIVE
MCB trip terus,NEGATIVE
TERKAIT NO LAPOR K5423052500232 PELANGGAN BERMAKSUD MENGAJUKAN PASANG BARU TARIF SUBSIDI DENGAN NO KTP PEMILIK BANGUNAN 3522042512940004  ATAS NAMA BUDI DARMAWAN. PEMOHON MENGAKU SEBAGAI PEMILIK PERSIL. NAMUN PADA DATA AP2T TERTERA NO KTP 3522042512940004  SUDAH TERDAFTAR SUBSIDI LISTRIK DENGAN ID PEL MILIK ORANG LAIN. SESUAI INFO PELANGGAN SUDAH DIKONFIRMASI PETUGAS DAN DIARAHKAN UNTUK DATANG KE KANTOR UNIT PELANGGAN TELAH DATANG KE UNIT TGL 13-03-2024 PUKUL 10.00 NAMUN PELANGGAN MERASA DIBERATKAN.,NEGATIVE
tombol nomor 145 rusak,NEGATIVE
"MOHON TINDAK LANJUT DAN PENYELESAIANNYA. BERDASARKAN INFO PELANGGAN TGL 22-02-2024TERJADI GANGGUAN APP PRABAYAR RUSAK DIPERSI TSB (G5424022218515) DAN TELAH DILAKUKAN PERBAIKAN OLEH PETUGAS BP. HADI DENGAN CARA SAMBUNG LANGSUNG (PASANG DUMMY), DIBERIKAN BERITA ACARA NAMUN TIDAK TERDAPAT NO.BA. PELANGGAN MENGINGINKAN AGAR SEGERA DILAKUKAN PENANGANAN SESUAI KETENTUAN. TERKAIT K5424031203649 BELUM ADA KONFIRMASI DAN TINDAK LANJUT STATUS DIBATALKAN.",NEGATIVE
kvhmeter tab. terbakar.leleh....,NEGATIVE
mab kwh meter rusak,NEGATIVE
"MOHON TINDAK LANJUT DAN PENYELESAIANNYA. BERDASARKAN INFO PELANGGAN TGL 22-02-2024TERJADI GANGGUAN APP PRABAYAR RUSAK DIPERSI TSB (G5424022218515) DAN TELAH DILAKUKAN PERBAIKAN OLEH PETUGAS BP. HADI DENGAN CARA SAMBUNG LANGSUNG (PASANG DUMMY), DIBERIKAN BERITA ACARA NAMUN TIDAK TERDAPAT NO.BA. PELANGGAN MENGINGINKAN AGAR SEGERA DILAKUKAN PENANGANAN SESUAI KETENTUAN",NEGATIVE
mohon dibantu pemasangan segel dibox kwh meter,POSITIF
sdh beli token tp belom masuk sampai skrng,NEGATIVE
MCB meteran sering jeglek..,NEGATIVE
listrik gak nyala mau d buat mroses + ngopen gabah,NEGATIVE
listrik gak nyala mau d buat ngopen gabah + mroses beras . gak ngangkat dayane,NEGATIVE
mcb gak bisa dan ada tulisan periksa,NEGATIVE
listrik mati nyala,NEGATIVE
listrik rumah padam,NEGATIVE
Mcb sering anjlok,NEGATIVE
MOHON PERIKSA APP DIKARENAKAN DIRAGUKAN BEROPERASINYA (KWH DIRASAKAN TIDAK BERKURANG). SEJAK TIDAK MENGETAHUI. SISA KWH 3200,NEGATIVE
"MOHON BANTUAN PENGECEKAN JIKA TETANGGA PELANGGAN PADAM BANYAK RUMAH SUDAH NORMAL/NYALA .NAMUN RUMAH PELANGGAN TIDAK OTOMATIS NYALA,HARUS MENG ON KAN MCB PLN DAHULU.B1T / 1300- SISA PULSA 180,67 KWH . SAAT INI PTL NYALA/NORMAL.",NEGATIVE
meteran tidak nyala,NEGATIVE
meteran tidak nyala,NEGATIVE
tidak adanya arus listrik di kabel,NEGATIVE
sudah 3x dari sore kemarin,NEGATIVE
"pasang baru no reg =5180112147503 status belum nyala,pekerjaan selesai kapan nyatanya...?",NEGATIVE
G 1224031000693,POSITIF
"kenapa saya tidak bisa mendapatkan subsidi listrik,saya harus membayar tagihan mahal setiap bulannya",NEGATIVE
kwh meter blank. lcd dan lampu indikator tidak menyala. tetapi listrik nya menyala,NEGATIVE
keluar tulisan periksa,NEGATIVE
sekring menyala,POSITIF
KWH Meter saya 2200 KWH Tapi setting daya berlebih di meteran hanya 1.530 sehingga sering padam karena di meteran muncul tulisan Berlebih.Mohon untuk disetting ulang batas overload KWH Kami ke 2.200,NEGATIVE
MOHON BANTU PEMNGAMANAN JARINGAN UNTUK HARI INI WARGA SUDAH SIAP DENGAN KEGIATAN TERSEBUT TGL  10/3/2024 MULAI PENGERJAAN PKL 09.00-10.00. MOHON BANTU KONFIRMASI PELANGGAN,POSITIF
"lampu berkedip trus listrik mati,tombol meteran juga tidak berfungsi",NEGATIVE
tombol gabisa dioencet,NEGATIVE
"MCB KWH Meter, setiap 15 menit, terputus WA yang jaga dilokasi : 081234066689",NEGATIVE
jika di hidupkan keluar suara gemuruh.kami tidak berani menghidupkan.,NEGATIVE
nct konslet rusak ndak bisa dinaikkan atau turunkan,NEGATIVE
NCT nya rusak,NEGATIVE
"listrik mati pulsa habis, tidak bisa di isi,",NEGATIVE
Sering tegangan listrik Tidak stabil dan sering pemadaman,NEGATIVE
mau beli pulsa tidak bisa ada keterangan di blokir,NEGATIVE
saat token di masukan muncul gagal terus padahal sudah benar,NEGATIVE
No listrik ke blokir,NEGATIVE
"Tidak bisa isi token, mengapa di blokir ?",NEGATIVE
Voltase tidak stabil,NEGATIVE
kemarin saya beli token tidak bisa dimasukan karena kWh meter rusak.akirnya diganti kWh meter baru.apakah bisa saya tukarkan ke nomer Idpel yang baru.,NEGATIVE
nomor token tidak dapat masuk/gagal keterangan inchek,NEGATIVE
"sudah tambah daya dari 2200 ke 5500, kwh meter masih 2200, dan sekarang nga bisa isi token.",NEGATIVE
Tegangan Listrik Sering Naik Turun Sudah 2 mingguan,NEGATIVE
meter layar mati,NEGATIVE
"MOHON INFORMASI KE PELANGGAN TERKAIT BIAYA MENINGGIKAN KABEL JTR YG KENDUR, KARENA RENOVASI MASJID, DAPAT MENGHUBUNGI KE 082132671584",POSITIF
"mau tambah daya, tapi kok sudah ada permohonan, padahal belum mengajukan, minta bantuannya",NEGATIVE
tidak bisa input token setelah tambah daya,NEGATIVE
kwh meter terblokir tidak bisa di isi pulsa,NEGATIVE
"seringkali listrik padam, dikit2 mati meskipun tidak hujan atau setelah gerimis sebentar, dan durasinya lama",NEGATIVE
mohon bantuannya utk pemindahan meteran listrik ke tembok samping ditempelkan,NEGATIVE
pada saat mau masukkan token listrik tombol nomer ada beberapa yg tidak fungsi (tidak bisa dipencet) sehingga tidak bisa melakukan pengisian token,NEGATIVE
nsb rusak,NEGATIVE
tidak ada angin dan hujan deras tp listrik dipadamkan!! mohon segera di tangani!,NEGATIVE
"kwh atau token listrik tidak berbunyi kalau mau habis, tiba-tiba listrik pad",NEGATIVE
ada kabe pln posisi turun,NEGATIVE
MCB tdk bisa on atau of rusak,NEGATIVE
Pemindahan dan Instalasi Tiang Kabel Listrik,NEGATIVE
"PELANGGAN INGIN DI BANTU UNTUK BUKA SEGEL APP KARENA KABEL TUFUR TERBAKAR DAN INGIN DILAKUKAN PERBAIKAN , PTL PADAM ,  HUB INI 082331294919",NEGATIVE
mat pagi dulur ini kWh muncul priksa GK bisa isi pulsa minta bantuan ya ni pulsa tinggal 1 kWh temksh,NEGATIVE
"TANGGAL 05/03/2024 PTL DIPUTUS SEMENTARA DAN TANGGAL 29/02/2024  TAGIHAN BULAN FEB 2024 BESERTA BK TELAH DILUNASI  PTL MINTA DISAMBUNG KEMBALI. PELANGGAN ADA INFO DIMINTA DATANG KE RAYON PLN SETEMPAT, NAMUN PELANGGAN INFOKAN ADA KENDALA KARENA SUDAH MALAM.",NEGATIVE
Meteran Menyala tapi lampu tidak menyala,NEGATIVE
"Sambungan listrik lampu depan konslet pak, saklar lampunya kalo di nyalakan langsung padam satu rumah",NEGATIVE
"PELANGGAN PENDAFTARAN PB B1T DAYA 1300 VA NO AGENDA 518019912306136064 REALISASI PENYAMBUNGAN TGL 14/06/2023, NAMUN UKURAN DAYA TERPASANG MCB 4 A (TIDAK SESUAI DENGAN DAYA KONTRAK).",NEGATIVE
mohon pengecekan meteran listrik karena 2 bulan ini hanya bayar 50 ribu biasanya diatas 100 ribu,NEGATIVE
"setelah migrasi ke token listrik sering padam sendiri posisi mcb msh on unt menyalakan lagi sekring hrs ditekan ""of"" dulu baru tekan lagi ""on"" listrik br nyala, tks.",NEGATIVE
token di masukkan gagal,NEGATIVE
"Sudah selesai melakukan pengisian token listrik, dan sudah ada keterangan pengisian berhasil.Tapi di meteran belum nambah sama dekali tokennya.",NEGATIVE
"Mhon maaf sblmnya pas tgl pengecekan kWh pada tgl 22 februari 2024 setelah petugas pergi/selesai mengecek sya catat brp kWh saat itu dan yg tertera adalah 35319,tapi stlh sya membayar tagihan listrik sya knapa d tagihan muncul kWh 35359 dan nominal rupiah nya pun jg otomatis bertambah pdhl pemakain bln 1 akhir hingga bln 2 itu jelas2 sya irit atu bnyk beberapa alat elektronik yg tidak sya fungsikan tapi mengapa tagihan listrik sya lebih mahal dari bulan Januari, mhon penjelasannya pa ad kecurangan dipihak pengecekan atau bagaimana???",NEGATIVE
kode token tidak bisa di masukkan kwh meter.,NEGATIVE
"meteran jeglek,dan muncul suara percikan listrik.",NEGATIVE
"KELUHAN BERULANG : K5124030400642, TGL 04/03/2024  PTL DIPUTUS SEMENTARA DAN TANGGAL 29/02/2024 TAGIHAN BULAN FEBRUARI 2024 BESERTA BK STATUSNYA TELAH DILUNASI (NAMUN PELANGGAN MERASA TIDAK MELAKUKAN PEMBAYARAN KARENA KETIKA PEMBAYARAN KETERANGAN TIDAK ADA TAGIHAN) PTL MINTA DISAMBUNG KEMBALI",NEGATIVE
TANGGAL 04/03/2024  PTL DIPUTUS SEMENTARA DAN TANGGAL 29/02/2024  TAGIHAN BULAN FEBRUARI 2024  BESERTA BK STATUSNYA TELAH DILUNASI (NAMUN PELANGGAN MERASA TIDAK MELAKUKAN PEMBAYARAN KARENA KETIKA PEMBAYARAN KETERANGAN TIDAK ADA TAGIHAN) PTL MINTA DISAMBUNG KEMBALI,NEGATIVE
meteran macet minta di ganti,NEGATIVE
"TANGGAL 29/02/24  TUNGGAKAN REKENING FEBRUARI 2024  BERIKUT BK TELAH DILUNASI PTL MINTA SEGERA DISAMBUNG ( ID PEL : 518011732183 , S2 / 900 )",NEGATIVE
ubah daya,POSITIF
ada Pohon bamabu potensi untun konlesting/pemadaman total desa Jelu (ranting bambu nempel ke jaringan kabel 3),POSITIF
Sudah memasukkan nomer token sesuai namun selalu gagal,NEGATIVE
Sudah memasukkan nomer token sesuai namun selalu gagal,NEGATIVE
MOHON TINDAK LANJUT DAN PENYELESAIANNYA. BERDASARKAN INFO PELANGGAN TERJADI GANGGUAN APP RUSAK DIPERSIL TSB DAN TELAH DILAKUKAN PERBAIKAN OLEH PETUGAS BP. BAGIO DENGAN CARA SAMBUNG LANGSUNG. PELANGGAN MENGINGINKAN AGAR SEGERA DILAKUKAN PENANGANAN SESUAI KETENTUAN.,NEGATIVE
mcb kwh meter,NEGATIVE
mcb kwh meter sering anjlok,NEGATIVE
token diblokir,NEGATIVE
"MOHON BANTUAN PENGECEKAN, PELANGGAN KONFIRMASI APP METER PELANGGAN SUDAH TUA/USANG, BELUM ADA PERGANTIAN/PEREMAJAAN SEJAK APP METER TERPASANG. SEHINGGA PELANGGAN MENGELUHKAN TAGIHAN BULANAN MENJADI MELONJAK JUGA",NEGATIVE
MEMASUKAN TOKEN LISTRIK SELALU GAGAL,NEGATIVE
"MOHON BANTUAN PENGECEKKAN PELANGGAN MERAGUKAN BEROPERASINYA APP METER PRABAYAR KARENA BOROS, DAN PELANGGAN INGIN APP METER DIGANTI KARENA SUDAH BERUMUR 14 TAHUN",NEGATIVE
"sudah laporan kemarin belum didatangi, masukkan token listrik gagal",NEGATIVE
mat pagi pak ni kWh padam 3rumah akibat ada getaran petir tadi malam minta bantuan,POSITIF
diisi token gagal terus,NEGATIVE
tidak bisa memasukkan nomor token,NEGATIVE
"PELANGGAN PENGAJUAN PINDAH TIANG,DIKARENAKAN DEPAN TOKO,NIK PELANGGAN 3522140308880002 /",NEGATIVE
Gagal Isi Token,NEGATIVE
"Listrik mati, meteran sudah posisi on",NEGATIVE
token tidak bisa masuk,NEGATIVE
"PELANGGAN PENDAFTARAN PB (B2/10600VA)NO AGENDA : 518019912402093987KODE PEMBAYARAN  : 5180111147188BP LUNAS PADA TGL (12/02/2024), PELANGGAN SUDAH MEMILIKI SLO, NAMUN HINGGA SAAT INI BELUM REALISASI",NEGATIVE
saya ingin membayar tagihan bulan februari kenapa yang muncul bulan maret ya kak..mohon infonya,NEGATIVE
Meteran listrik keliatannya tidak jalan,NEGATIVE
meter listrik menunjukan tulisan periksa berulang ulang,NEGATIVE
isi token selalu gagal jadi tidak bisa diisi tokennya padahal sudah dicek nomer token dan meteran sudah betul,NEGATIVE
gagal isi token,NEGATIVE
listrik nyala walau mcb of setelah tersambar petir,POSITIF
gak bisa beli token,NEGATIVE
gak bisa beli token,NEGATIVE
"voltase sudah 3 tahun segini-gini terus., sudah lapor email, surat ke ULP telpon 123 masih belum terselesaikan",NEGATIVE
daya listrik menurun gak sampek 180,NEGATIVE
mat siang ini KWh ke blokir gagal beli token tolong kirimi nmr registrasinya ya kak ?,NEGATIVE
nomer 7 8 9 pada tombol token tidak bisa keluar angkanya,NEGATIVE
"minta kode temper kirim ke 085730034798, saya bisa mengisi sendiri.",POSITIF
apa ada masalah untuk pembelian token?kenapa tidak bisa beli token?apa ada masalah?,NEGATIVE
clear temper,NEGATIVE
Saklar mcb dol,NEGATIVE
Tagihan listrik naik,NEGATIVE
"Info dari PLN Sumberrjo verifikasi subsidi tidak dapat diproses karena data di PLN tidak sesuai dengan KTP dan KK, harus mengurus Data Di Dinas Sosial, Info dari Dinas Sosial terkait Data DTKS sesuai dengan KTP dan KK tidak dapat dirubah, untuk itu apakah dapat merubah Data yang terdaftar di PLN agar sesuai KTP",NEGATIVE
Pindah Ke TOKEN,POSITIF
Pindah Ke TOKEN,POSITIF
"ID PEL 518010713706. MOHON PERIKSA APP 3 BULAN LALU ANGKA REGISTER TDK BEROPERASI NAMUN TIDAK ADA PEMAKAIAN LISTRIK DIKARENAKAN TIDAK TAHU PENYEBABNYA STAND APP TGL 27-02-2024 = 3278. PELANGGAN PERNAH LAPOR DENGAN NO: K5424022702533, STATUS SELESAI, PELANGGAN SDH DIHUBUNGI OLEH PETUGAS DAN DIINFORMASIKAN AKAN DILAKUKAN PENORMALAN NAMUN BLM ADA TINDAK LANJUT.",NEGATIVE
"MOHON PERIKSA APP. APP RUSAK DAN ANGKA STAND APP TGL 27-02-2024 = 3278. SESUAI INFORMASI PELANGGAN TERJADI KERUSAKAN SEJAK BULAN JANUARI 2024. MCB ON ATAU OFF INDIKATOR TETAP BERJALAN. HINGGA SAAT INI BELUM ADA TINDAKLANJUT DARI PETUGAS. PELANGGAN PERNAH LAPOR DENGAN NO: K5424022702533, STATUS SELESAI, PELANGGAN TIDAK KONFIRMASI s.d 1X6 JAM.",NEGATIVE
info syarat baliknama,NEGATIVE
CARA MENDAPATKAN SUBSIDI LISTRIK ITU GIMANA LANGKAHNYA?,NEGATIVE
"KELUHAN BERULANG : K5124022701565, LAYAR APP METER PADAM, PTL NYALA,",NEGATIVE
"LAYAR APP METER PADAM, PTL NYALA,",NEGATIVE
TANGGAL 27 FEB 2024  PTL DIPUTUS SEMENTARA DAN TANGGAL 27 FEB 2024  TAGIHAN BULAN FEB 2024 BESERTA BK TELAH DILUNASI  PTL MINTA DISAMBUNG KEMBALI,NEGATIVE
ingin ubah di subsidi,NEGATIVE
mati lampu sebagian,NEGATIVE
Pengajuan Subsidi,NEGATIVE
"MOHON BANTUAN KONFIRMASI TERKAIT SAAT PROSES PB TERDATA DENGAN TARIF SUBSIDI (R1T / 900) SEJAK REALISASI PB BULAN NOVEMBER 2023. NIK KTP 3522214509750004 A/N TI'AH. SAAT PELANGGAN MEMBELI TOKEN, TARIF BERUBAH MENJADI R1MT / 900. PELANGGAN TDK PERNAH PENGAJUAN PERUBAHAN TARIF DAN PERNAH PENGAJUAN PERUBAHAN TARIF KE PETUGAS NAMUN BLM ADA TINDAKLANJUT",NEGATIVE
"MOHON BANTUAN PENGECEKAN DIRAGUKAN KONDISI BEROPERASINYA LPB  50162405067 ( DISPLAY MUNCUL KET RUSAK  ) SEJAK 27/02/2024 ( SETELAH ADA PEMADAMAN DILOKASI ) . ""SISA PULSA =  35.81 KWH ( PTL NYALA )  .  TERIMAKASIH",NEGATIVE
MOHON PERIKSA APP 3 BULAN LALU ANGKA REGISTER BEROPERASI  ) NAMUN TIDAK ADA PEMAKAIAN LISTRIK DIKARENAKAN TIDAK TAHU PENYEBABNYA STAND APP TGL 27-02-2024 = 3278//SESUAI INFORMASI PELANGGAN BELUM ADA TINDAKLANJUT DARI UNIT PLN SETEMPAT. CC.54.ARIO.SM TGL. 27-02-24 JAM 11.41,NEGATIVE
pasang baru tapi tidak bisa melakukan pembayaran,NEGATIVE
"Setum tidak masuk ke rumah, meteran listrik belum ada MCB.",NEGATIVE
MOHON UNTUK DITINDAKLANJUTI. SEKITAR BULAN DES 23 PELANGGAN DATANG KE APL SETEMPAT PENGAJUAN PROSES PB 10.600 VA NAMUN SESUAI INFO PETUGAS WILAYAH SETEMPAT DISARANKAN MENGGUNAKAN DAYA 41.500 VA YBS MERASA TERLALU TINGGI UNTUK DAYA TSB DAN YBS SUDAH MENGAJUKAN SURAT KEBERATAN KE AREA NAMUN HINGGA SAAT INI BELUM ADA TINDAK LANJUT.,NEGATIVE
"Alarm listrik tidak bunyi, tiba"" sudah padam, bagaimana caranya agar membunyikan alarm listrik lagi?",NEGATIVE
sering terjadinya mati lampu,NEGATIVE
tidak bisa isi token pulsa,NEGATIVE
mau isi token bisa masuk.,NEGATIVE
"MOHON PERIKSA APP, KACA APP BURAM BANYAK KOTORAN HEWAN SEHINGGA TIDAK DAPAT TERLIHAT.",NEGATIVE
"izin lapor, hari ini senin tanggal 26-2-2024 pukul 09:28:33 saya sudah melakukan pembayaran listrik atas nama parti nomor rekening 518013458173 dengan total bayar Rp.176.665,   tapi ternyata siangnya siangnya masih ada petugas PLN yang memberikan struk pemutusan sementara, akhirnya sama orangvtua saya dibayari lagi dengan jumlah uang Rp.177.165, dikeranakan tidak tau kalau saya sudah membayar, sedangkan saya pas posisi kerjapertanyaan saya apakah uang saya bisa dikembalikan?",NEGATIVE
"voltase phase R sering drop tiap jam, mohon segera di tindak lanjuti",NEGATIVE
token sudah beli dari tokopedia tapi tidak bisa dimasukkan,NEGATIVE
gagal masukan token,NEGATIVE
mau isi toke gagal terus,NEGATIVE
kabel listrik tertimpa pohon jati roboh,NEGATIVE
perubahan daya sudah 3 hari belum pelaksanaan penyambungan,NEGATIVE
tidak bisa isi token kiped rusak,NEGATIVE
meteran mati,NEGATIVE
kabel jtr jatuh didepan gerbang sekolahan,NEGATIVE
MOHON TINDAK LANJUT DAN PENYELESAIANNYA. BERDASARKAN INFO PELANGGAN TGL 21-02-2024 TERJADI GANGGUAN KEYPAD RUSAK TERKAIT LAPORAN G5224022102131 DIPERSIL TSB DAN TELAH DILAKUKAN PERBAIKAN OLEH PETUGAS BP. ANDRE DAN SUROSO DENGAN CARA SAMBUNG LANGSUNG DENGAN BERITA ACARA. PELANGGAN MENGINGINKAN AGAR SEGERA DILAKUKAN PENANGANAN SESUAI KETENTUAN.,NEGATIVE
"kwh meter terkadang menimbulkan suara bendengung, setiap kali berdengung disertai lampu rumah dan peralatan  elektronik yg berkedip, dan terkadang listrik mati padahal posisi saklar kwh meter dan sekreng ON",NEGATIVE
Konsleting Listrik,NEGATIVE
"PELANGGAN TIDAK BISA INPUT TOKEN KET. GAGAL, SISA TOKEN : 290 KWH (PTL TIDAK PADAM)",NEGATIVE
"voltase turun drastis, tidak cuma rumah ini, tapi beberapa rumah juga, lampu dan elektronik tidak dapat nyala,",NEGATIVE
mohon dibantu penormalannya tegangan tidak normal di satu bangunan BTS tower,NEGATIVE
"token dimasukkan salah trs, pdhal udh benar",NEGATIVE
"token gk bs msk, salah trs",NEGATIVE
"DISPLAY APP PADAM/BLANK SEJAK 24/02/2024. PTL MENYALA, INGIN SEGERA DITANGANI KARENA AKAN MENGISI PULSA",NEGATIVE
"untuk melengkapi seal tera ,karena aktual tidak lengkap",NEGATIVE
perubahan daya,NEGATIVE
TGL 24/02/24  REK FEBRUARI 24 BERIKUT BK  TELAH DILUNASI VIA BANK BCA. PTL MINTA SEGERA DISAMBUNG KEMBALI,NEGATIVE
token tidak bisa di masukkan,NEGATIVE
mau di isi keburu mati,NEGATIVE
tidak bisa input token,NEGATIVE
"PELANGGAN MELAPORKAN PERTANGGAL HARI INI 23 FEBRUARI 2024 ADA PERGANTIAN KWH METER UNTUK PEREMAJAAN, NAMUN SEBELUM DIGANTI MASIH ADA SISA STROOMNYA DAN DIKWH METER SEKARANG HANYA MUNCUL 4.67 KWH. MOHON DIBANTU DAN KONFIRMASI PELANGGAN.",NEGATIVE
Lampu rumah mati.,NEGATIVE
pembelian token no idpel selalu salah,NEGATIVE
"Saklar meteran tiba-tiba sering mati sendiri, sudah 4x sejak tadi pagi. Mohon bantuannya untuk diperiksa.",NEGATIVE
KWH meter suka turun/mati dimalam hari,NEGATIVE
KWH meter Nga bisa ke On,NEGATIVE
token dimasukkan gagal terus,NEGATIVE
Pengisian Token Tidak Bisa,NEGATIVE
mohon bantuannya untuk memindahkan meteran listrik..alamat jl panglima polim sumbang gg relloco depan gladiator..,NEGATIVE
kode token tidak bisa di masukkan kwh meter,NEGATIVE
sekitar 1  minggu voltase anjlok lagi,NEGATIVE
telah mengalami pemadaman seagian,NEGATIVE
"PERMOHONAN PS NON PELANGGAN   DAYA : 23000 VA  TANGGAL PELAKSANAAN : 22/2/2024 , PUKUL :07.00   WIB, DENGAN NOMER AGENDA  518010532402210023 NO REGISTER 5180129006308  SUDAH LUNAS TANGGAL : 21/02/2024 NAMUN HINGGA SAAT INI BELUM REALISASI.",NEGATIVE
